{
  "schemaVersion": "1.2",
  "id": "replace-with-product-id",
  "name": "Product name",
  "domain": "Domain and operating environment",
  "audience": "Primary audience and expertise",
  "jobs": [
    "The most important job this surface must help complete"
  ],
  "character": [
    "clear",
    "distinctive"
  ],
  "avoid": [
    "A visual treatment that would damage trust or domain fit"
  ],
  "traits": {
    "density": "Explain the target density and why",
    "hierarchy": "Explain the reading and action order",
    "typography": "Explain voice, roles, and numeric treatment",
    "motion": "Explain where motion communicates state and where it stops"
  },
  "genome": {
    "semantics": ["Define state, action, consequence, and evidence before choosing visual expression."],
    "behavior": ["Every interactive action has a named state transition and observable post-condition."],
    "accessibility": ["Keyboard, focus, assistive names, reduced motion, and zoom remain equivalent to the visual path."],
    "contentLocale": ["Product language, long localized content, and numeric conventions preserve task meaning."],
    "dataTruth": ["Visible values, accessible summaries, provenance, and limitations describe the same data state."],
    "permissionsPrivacy": ["The least-privilege boundary and private-by-default data policy are explicit."],
    "recovery": ["Destructive or uncertain actions expose a bounded recovery owner, route, and verification step."]
  },
  "tokens": {
    "foundation": {
      "color.canvas": {"$type":"color","$value":"#F5F3EC"},
      "color.surface": {"$type":"color","$value":"#FFFFFF"},
      "color.ink": {"$type":"color","$value":"#14191F"},
      "color.muted": {"$type":"color","$value":"#66717D"},
      "color.line": {"$type":"color","$value":"#D9DEE3"},
      "color.accent": {"$type":"color","$value":"#315CFF"},
      "color.accent-ink": {"$type":"color","$value":"#FFFFFF"},
      "font.sans": {"$type":"fontFamily","$value":"Inter, Pretendard, sans-serif"},
      "font.mono": {"$type":"fontFamily","$value":"ui-monospace, SFMono-Regular, Consolas, monospace"},
      "font.display-weight": {"$type":"fontWeight","$value":760},
      "font.body-weight": {"$type":"fontWeight","$value":450},
      "type.base-size": {"$type":"dimension","$value":"16px"},
      "type.line-height": {"$type":"number","$value":1.55},
      "space.unit": {"$type":"dimension","$value":"4px"},
      "space.content-max": {"$type":"dimension","$value":"1200px"},
      "space.section-gap": {"$type":"dimension","$value":"96px"},
      "radius.control": {"$type":"dimension","$value":"10px"},
      "radius.panel": {"$type":"dimension","$value":"20px"},
      "duration.fast": {"$type":"duration","$value":"120ms"},
      "duration.standard": {"$type":"duration","$value":"240ms"},
      "easing.standard": {"$type":"cubicBezier","$value":"cubic-bezier(.2,.8,.2,1)"}
    },
    "semantic": {
      "surface.canvas": {"$type":"color","$value":"{foundation.color.canvas}"},
      "surface.panel": {"$type":"color","$value":"{foundation.color.surface}"},
      "text.primary": {"$type":"color","$value":"{foundation.color.ink}"},
      "text.muted": {"$type":"color","$value":"{foundation.color.muted}"},
      "border.default": {"$type":"color","$value":"{foundation.color.line}"},
      "action.accent": {"$type":"color","$value":"{foundation.color.accent}"},
      "action.on-accent": {"$type":"color","$value":"{foundation.color.accent-ink}"},
      "type.body": {"$type":"fontFamily","$value":"{foundation.font.sans}"},
      "type.code": {"$type":"fontFamily","$value":"{foundation.font.mono}"},
      "space.unit": {"$type":"dimension","$value":"{foundation.space.unit}"},
      "shape.control": {"$type":"dimension","$value":"{foundation.radius.control}"},
      "shape.panel": {"$type":"dimension","$value":"{foundation.radius.panel}"},
      "motion.fast": {"$type":"duration","$value":"{foundation.duration.fast}"},
      "motion.standard": {"$type":"duration","$value":"{foundation.duration.standard}"},
      "motion.easing": {"$type":"cubicBezier","$value":"{foundation.easing.standard}"}
    },
    "component": {
      "panel.background": {"$type":"color","$value":"{semantic.surface.panel}"},
      "panel.border": {"$type":"color","$value":"{semantic.border.default}"},
      "button.background": {"$type":"color","$value":"{semantic.action.accent}"},
      "button.text": {"$type":"color","$value":"{semantic.action.on-accent}"},
      "button.radius": {"$type":"dimension","$value":"{semantic.shape.control}"},
      "focus.ring": {"$type":"color","$value":"{semantic.action.accent}"},
      "data.accent": {"$type":"color","$value":"{semantic.action.accent}"}
    }
  },
  "signatureMoment": "One memorable interaction or composition that expresses the domain without blocking the job.",
  "evidence": []
}
