{
  "schemaVersion": "1.2",
  "id": "spatial-studio",
  "name": "Orbit Spatial Studio",
  "domain": "Interactive spatial exploration and creative prototyping",
  "audience": "Designers and engineers exploring relationships before committing structure",
  "jobs": ["See relationships and regions", "Move between overview and precise inspection without losing place"],
  "character": ["spatial", "kinetic", "confident", "tactile"],
  "avoid": ["canvas-only semantics", "unbounded particle decoration", "motion without state meaning"],
  "traits": {
    "density": "A quiet stage with dense detail at the active locus",
    "hierarchy": "Spatial focus plus a stable DOM inspector and breadcrumb",
    "typography": "Technical sans labels with large coordinate-like display type",
    "motion": "Continuous motion is decorative and optional; navigation motion preserves orientation"
  },
  "genome": {
    "semantics": ["Spatial relationships always have an equivalent named DOM representation and stable selection state."],
    "behavior": ["Overview, focus, and precise inspection preserve location and selection across transitions."],
    "accessibility": ["Canvas motion is optional while keyboard, focus, reduced motion, and DOM inspection remain complete."],
    "contentLocale": ["Coordinates, labels, and long Korean descriptions remain distinct and readable at every scale."],
    "dataTruth": ["The canvas scene and the inspector expose the same selected entity, relation, and evidence state."],
    "permissionsPrivacy": ["Imported spatial assets disclose origin and stay local unless export is explicitly authorized."],
    "recovery": ["A failed transform can return to the last stable view, selection, and camera state."]
  },
  "tokens": {
    "foundation": {
      "color.canvas":{"$type":"color","$value":"#080A13"},"color.surface":{"$type":"color","$value":"#12162A"},"color.ink":{"$type":"color","$value":"#F5F2FF"},"color.muted":{"$type":"color","$value":"#A5A8C1"},"color.line":{"$type":"color","$value":"#2C3156"},"color.accent":{"$type":"color","$value":"#8875FF"},"color.accent-ink":{"$type":"color","$value":"#FFFFFF"},
      "font.sans":{"$type":"fontFamily","$value":"Inter, Pretendard, sans-serif"},"font.mono":{"$type":"fontFamily","$value":"JetBrains Mono, Consolas, monospace"},"font.display-weight":{"$type":"fontWeight","$value":790},"font.body-weight":{"$type":"fontWeight","$value":450},"type.base-size":{"$type":"dimension","$value":"16px"},"type.line-height":{"$type":"number","$value":1.5},
      "space.unit":{"$type":"dimension","$value":"4px"},"space.content-max":{"$type":"dimension","$value":"1600px"},"space.section-gap":{"$type":"dimension","$value":"72px"},"radius.control":{"$type":"dimension","$value":"999px"},"radius.panel":{"$type":"dimension","$value":"28px"},"duration.fast":{"$type":"duration","$value":"140ms"},"duration.standard":{"$type":"duration","$value":"360ms"},"easing.standard":{"$type":"cubicBezier","$value":"cubic-bezier(.16,1,.3,1)"}
    },
    "semantic": {
      "surface.canvas":{"$type":"color","$value":"{foundation.color.canvas}"},"surface.panel":{"$type":"color","$value":"{foundation.color.surface}"},"text.primary":{"$type":"color","$value":"{foundation.color.ink}"},"text.muted":{"$type":"color","$value":"{foundation.color.muted}"},"border.default":{"$type":"color","$value":"{foundation.color.line}"},"action.accent":{"$type":"color","$value":"{foundation.color.accent}"},"action.on-accent":{"$type":"color","$value":"{foundation.color.accent-ink}"},"type.body":{"$type":"fontFamily","$value":"{foundation.font.sans}"},"type.code":{"$type":"fontFamily","$value":"{foundation.font.mono}"},"space.unit":{"$type":"dimension","$value":"{foundation.space.unit}"},"shape.control":{"$type":"dimension","$value":"{foundation.radius.control}"},"shape.panel":{"$type":"dimension","$value":"{foundation.radius.panel}"},"motion.fast":{"$type":"duration","$value":"{foundation.duration.fast}"},"motion.standard":{"$type":"duration","$value":"{foundation.duration.standard}"},"motion.easing":{"$type":"cubicBezier","$value":"{foundation.easing.standard}"}
    },
    "component": {
      "panel.background":{"$type":"color","$value":"{semantic.surface.panel}"},"panel.border":{"$type":"color","$value":"{semantic.border.default}"},"button.background":{"$type":"color","$value":"{semantic.action.accent}"},"button.text":{"$type":"color","$value":"{semantic.action.on-accent}"},"button.radius":{"$type":"dimension","$value":"{semantic.shape.control}"},"focus.ring":{"$type":"color","$value":"{semantic.action.accent}"},"data.accent":{"$type":"color","$value":"{semantic.action.accent}"}
    }
  },
  "signatureMoment": "A selected relation sends one restrained pulse across the stage while the equivalent DOM inspector announces the change.",
  "evidence": ["renderer:canvas-plus-dom", "accessibility:fallback-required"]
}
